[
  {
    "claim_id": "c1",
    "source_span": {
      "file": "original.md",
      "start_line": 1,
      "end_line": 1,
      "quote": "Caddy is written in Go."
    },
    "claim_text": "Caddy is written in Go.",
    "claim_type": "ATTR",
    "subject": "unknown",
    "predicate": "unknown",
    "object": "Caddy is written in Go.",
    "scope": "dataset-provided",
    "time_context": "dataset-provided",
    "verifiability": "public",
    "importance": "medium",
    "risk_level": "medium"
  }
]
