[
  {
    "claim_id": "c1",
    "source_span": {
      "file": "original.md",
      "start_line": 1,
      "end_line": 1,
      "quote": "Tool X is MIT licensed."
    },
    "claim_text": "Tool X is MIT licensed.",
    "claim_type": "STATUS",
    "subject": "unknown",
    "predicate": "unknown",
    "object": "Tool X is MIT licensed.",
    "scope": "dataset-provided",
    "time_context": "dataset-provided",
    "verifiability": "public",
    "importance": "medium",
    "risk_level": "medium"
  },
  {
    "claim_id": "c2",
    "source_span": {
      "file": "original.md",
      "start_line": 1,
      "end_line": 1,
      "quote": "Tool X only works on Windows."
    },
    "claim_text": "Tool X only works on Windows.",
    "claim_type": "COMPAT",
    "subject": "unknown",
    "predicate": "unknown",
    "object": "Tool X only works on Windows.",
    "scope": "dataset-provided",
    "time_context": "dataset-provided",
    "verifiability": "public",
    "importance": "medium",
    "risk_level": "medium"
  }
]
